{"schema_version":"v1","id":"pb-001","kind":"problem-brief","created_at":"2026-08-22T00:00:00Z","correlation_id":"c-001","title":"Contract baseline","problem":"Define stable v2 boundaries.","outcomes":["Schemas can be validated"],"constraints":["No credentials in state"],"acceptance":["make contracts passes"]}
